{
  "format": "flow-overlay@1",
  "flowId": "book-deconstruct",
  "origin": "user",
  "reason": "实验批口径（用户 2026-09-17 拍板）：kit 边界门自动放行，journal 留痕，产物齐后统一人裁",
  "patches": [
    {
      "kind": "set-policy",
      "key": "kit_boundary",
      "value": "auto",
      "reason": "实验批：跨域交接验收门自动通过，最终产物由用户统一裁决"
    }
  ]
}
