{
  "format": "flow-overlay@1",
  "flowId": "screenplay",
  "origin": "factory",
  "reason": "ComfyUI Script 预设：分集分镜后追加 Seedance 视频提示词产出（insert-tool 同实例追加，不改拓扑）",
  "patches": [
    {
      "kind": "insert-tool",
      "module": "m3",
      "tool": "render-prompt-seedance",
      "slot": "end",
      "reason": "在 drama 分集分镜后追加 Seedance 提示词生成（op 已注册进 drama 模块，requires 为空可直接插）"
    },
    {
      "kind": "set-tool",
      "kit": "drama",
      "op": "render-prompt-seedance",
      "config": {
        "shotSec": 5
      },
      "reason": "出厂定档：单镜头 5 秒（cameraLock/consistencyLock 沿用 op 默认词库）"
    }
  ]
}
